{
  "schema_version": "1.0.0",
  "generated_at": "2026-08-18T00:00:00+08:00",
  "evidence_scope": "source_inventory_only",
  "source_inventory": {
    "starting_paths": [
      "frontweb/src/router/index.js",
      "frontweb/src/components/PlatformPrimaryNav.vue",
      "frontweb/src/views/DramaCanvas.vue",
      "frontweb/src/views/FilmCreate.vue",
      "frontweb/src/views/ScriptAnalysis.vue",
      "backend-node/src/routes/index.js"
    ],
    "scope_note": "本清单仅枚举当前仓库中的入口、控件、公开 API 与已有测试映射，用于追踪后续验收；不代表浏览器、真实服务、供应商、工件、计费或生产验收已通过。"
  },
  "features": [
    { "feature_id": "shared.auth.route_permission", "module": "shared", "entry_route": "/login", "control_label": "登录与受保护路由", "action_kind": "permission", "required_role": "public", "writes_state": true, "may_charge": false, "acceptance_chain": ["browser", "auth", "api", "writeback"], "source_paths": ["frontweb/src/router/index.js", "frontweb/src/utils/authGuard.js", "frontweb/src/api/auth.js", "backend-node/src/routes/auth.js"], "test_paths": ["frontweb/test/authGuard.test.js", "backend-node/test/authRoutes.test.js"], "baseline_state": "unverified" },
    { "feature_id": "shared.admin.permission_boundary", "module": "shared", "entry_route": "/billing-admin", "control_label": "平台管理员权限边界", "action_kind": "permission", "required_role": "admin", "writes_state": false, "may_charge": false, "acceptance_chain": ["browser", "auth", "api"], "source_paths": ["frontweb/src/router/index.js", "frontweb/src/utils/platformRbac.js", "backend-node/src/routes/index.js"], "test_paths": ["frontweb/test/platformRbac.test.js", "backend-node/test/platformRbac.test.js", "backend-node/test/billingAdminRbacRoutes.test.js"], "baseline_state": "unverified" },
    { "feature_id": "shared.navigation.primary_modules", "module": "shared", "entry_route": "/", "control_label": "首页、画布、剧本分析、短剧工厂顶部导航", "action_kind": "navigation", "required_role": "public", "writes_state": false, "may_charge": false, "acceptance_chain": ["browser"], "source_paths": ["frontweb/src/components/PlatformPrimaryNav.vue", "frontweb/src/components/PlatformHeader.vue"], "test_paths": ["frontweb/test/filmListCanvasEntry.test.js", "frontweb/e2e/project-workspace.spec.js"], "baseline_state": "unverified" },
    { "feature_id": "shared.billing.credit_account", "module": "shared", "entry_route": "/tenant-console", "control_label": "积分余额与流水查询", "action_kind": "billing", "required_role": "user", "writes_state": false, "may_charge": false, "acceptance_chain": ["browser", "auth", "api", "billing"], "source_paths": ["frontweb/src/components/AccountBadge.vue", "frontweb/src/api/billing.js", "backend-node/src/routes/index.js", "backend-node/src/routes/billing.js"], "test_paths": ["frontweb/test/billingDisplay.test.js", "backend-node/test/billingRoutes.test.js", "frontweb/e2e/tenant-console-public.spec.js"], "baseline_state": "unverified" },
    { "feature_id": "shared.billing.generation_catalog", "module": "shared", "entry_route": "/canvas/:id", "control_label": "生成模型价格与预计扣费数据", "action_kind": "billing", "required_role": "user", "writes_state": false, "may_charge": false, "acceptance_chain": ["browser", "auth", "api", "billing"], "source_paths": ["frontweb/src/api/billing.js", "frontweb/src/utils/billingDisplay.js", "backend-node/src/routes/index.js", "backend-node/src/routes/billing.js"], "test_paths": ["backend-node/test/billingPublicCatalog.test.js", "backend-node/test/modelPrice.test.js", "frontweb/test/videoResolutionPricingContract.test.js"], "baseline_state": "unverified" },
    { "feature_id": "shared.assets.library_api", "module": "shared", "entry_route": "/media-library", "control_label": "媒体素材库与资产接口", "action_kind": "asset_library", "required_role": "user", "writes_state": true, "may_charge": false, "acceptance_chain": ["browser", "auth", "api", "artifact", "writeback"], "source_paths": ["frontweb/src/views/MediaLibrary.vue", "frontweb/src/api/assets.js", "backend-node/src/routes/index.js", "backend-node/src/routes/assets.js"], "test_paths": ["frontweb/test/mediaLibraryRouteFocus.test.js", "backend-node/test/canvasAssetPersistence.integration.test.js"], "baseline_state": "unverified" },
    { "feature_id": "shared.api.auth_session", "module": "shared", "entry_route": "/api/v1/auth/*", "control_label": "注册、登录、登出、密码与当前会话接口", "action_kind": "api", "required_role": "public", "writes_state": true, "may_charge": false, "acceptance_chain": ["auth", "api", "writeback"], "source_paths": ["backend-node/src/routes/index.js", "backend-node/src/routes/auth.js", "frontweb/src/api/auth.js"], "test_paths": ["backend-node/test/authRoutes.test.js", "backend-node/test/userAuth.test.js", "frontweb/test/authSession.test.js"], "baseline_state": "unverified" },
    { "feature_id": "shared.api.tenant_member", "module": "shared", "entry_route": "/api/v1/tenants*", "control_label": "工作区与成员管理接口", "action_kind": "api", "required_role": "user", "writes_state": true, "may_charge": false, "acceptance_chain": ["auth", "api", "writeback"], "source_paths": ["backend-node/src/routes/index.js", "backend-node/src/routes/tenants.js", "frontweb/src/api/tenants.js"], "test_paths": ["backend-node/test/tenantRoutes.test.js", "backend-node/test/tenantMemberRoleHierarchy.test.js"], "baseline_state": "unverified" },
    { "feature_id": "shared.api.platform_account_admin", "module": "shared", "entry_route": "/api/v1/platform-admin/users*", "control_label": "平台账号查询与强制登出接口", "action_kind": "api", "required_role": "admin", "writes_state": true, "may_charge": false, "acceptance_chain": ["auth", "api", "writeback"], "source_paths": ["backend-node/src/routes/index.js", "backend-node/src/routes/platformAccounts.js", "frontweb/src/api/platformAccounts.js"], "test_paths": ["backend-node/test/platformAdminRoutes.test.js", "backend-node/test/platform-admin-service.test.js", "frontweb/test/platformRbac.test.js"], "baseline_state": "unverified" },
    { "feature_id": "shared.api.billing_account", "module": "shared", "entry_route": "/api/v1/billing/account|credit-transactions", "control_label": "积分账户、余额与流水查询接口", "action_kind": "api", "required_role": "user", "writes_state": false, "may_charge": false, "acceptance_chain": ["auth", "api", "billing"], "source_paths": ["backend-node/src/routes/index.js", "backend-node/src/routes/billing.js", "frontweb/src/api/billing.js"], "test_paths": ["backend-node/test/billingRoutes.test.js", "frontweb/test/billingDisplay.test.js"], "baseline_state": "unverified" },
    { "feature_id": "shared.api.billing_catalog", "module": "shared", "entry_route": "/api/v1/billing/catalog|plans|subscription", "control_label": "计费目录、套餐与订阅查询接口", "action_kind": "api", "required_role": "user", "writes_state": false, "may_charge": false, "acceptance_chain": ["auth", "api", "billing"], "source_paths": ["backend-node/src/routes/index.js", "backend-node/src/routes/billing.js", "frontweb/src/api/billing.js"], "test_paths": ["backend-node/test/billingPublicCatalog.test.js", "backend-node/test/subscriptionBillingRoutes.test.js"], "baseline_state": "unverified" },
    { "feature_id": "shared.api.billing_redeem", "module": "shared", "entry_route": "/api/v1/billing/redeem*", "control_label": "兑换积分与兑换码管理接口", "action_kind": "api", "required_role": "user", "writes_state": true, "may_charge": false, "acceptance_chain": ["auth", "api", "billing", "writeback"], "source_paths": ["backend-node/src/routes/index.js", "backend-node/src/routes/billing.js", "frontweb/src/api/billing.js"], "test_paths": ["backend-node/test/redeem-code-routes.test.js", "backend-node/test/redeem-code-service.test.js", "frontweb/test/redeem-admin-console.test.js"], "baseline_state": "unverified" },
    { "feature_id": "shared.api.billing_orders", "module": "shared", "entry_route": "/api/v1/billing/orders*", "control_label": "计费订单查询、创建与取消接口", "action_kind": "api", "required_role": "user", "writes_state": true, "may_charge": false, "acceptance_chain": ["auth", "api", "billing", "writeback"], "source_paths": ["backend-node/src/routes/index.js", "backend-node/src/routes/billing.js", "frontweb/src/api/billing.js"], "test_paths": ["backend-node/test/subscriptionBillingRoutes.test.js", "backend-node/test/subscriptionBillingService.test.js"], "baseline_state": "unverified" },
    { "feature_id": "shared.api.billing_recharge", "module": "shared", "entry_route": "/api/v1/billing/recharge/*", "control_label": "充值配置、套餐与支付宝充值接口", "action_kind": "api", "required_role": "user", "writes_state": true, "may_charge": true, "acceptance_chain": ["auth", "api", "billing", "writeback"], "source_paths": ["backend-node/src/routes/index.js", "backend-node/src/routes/alipay-recharge.js", "frontweb/src/api/billing.js"], "test_paths": ["backend-node/test/alipay-recharge-routes.test.js", "frontweb/e2e/recharge-center.spec.js"], "baseline_state": "unverified" },
    { "feature_id": "shared.api.billing_admin_pricing", "module": "shared", "entry_route": "/api/v1/billing/admin/*|prices/*", "control_label": "计费管理员、模型定价与账本设置接口", "action_kind": "api", "required_role": "admin", "writes_state": true, "may_charge": false, "acceptance_chain": ["auth", "api", "billing", "writeback"], "source_paths": ["backend-node/src/routes/index.js", "backend-node/src/routes/billing.js", "frontweb/src/api/billing.js"], "test_paths": ["backend-node/test/billingAdminRbacRoutes.test.js", "backend-node/test/modelPrice.test.js", "frontweb/test/billing-ledger-admin.test.js"], "baseline_state": "unverified" },